Welcome to the MySQL monitor.  Commands end with ; or \g.
Your MySQL connection id is 10
Server version: 8.0.30 MySQL Community Server - GPL

Copyright (c) 2000, 2022, Oracle and/or its affiliates.

Oracle is a registered trademark of Oracle Corporation and/or its
affiliates. Other names may be trademarks of their respective
owners.

Type 'help;' or '\h' for help. Type '\c' to clear the current input statement.

mysql> show databases;
+--------------------+
| Database           |
+--------------------+
| information_schema |
| mysql              |
| performance_schema |
| sys                |
| test               |
+--------------------+
5 rows in set (0.04 sec)

mysql> use test;
Database changed
mysql> show tables;
+----------------+
| Tables_in_test |
+----------------+
| employee       |
+----------------+
1 row in set (0.01 sec)

mysql> describe employee;
+-------+-------------+------+-----+---------+-------+
| Field | Type        | Null | Key | Default | Extra |
+-------+-------------+------+-----+---------+-------+
| id    | int         | YES  |     | NULL    |       |
| name  | varchar(50) | YES  |     | NULL    |       |
+-------+-------------+------+-----+---------+-------+
2 rows in set (0.01 sec)

mysql> create table if not exists employee(id int,salary double,hiring_date date);
Query OK, 0 rows affected, 1 warning (0.01 sec)

mysql> create table if not exists employee_with_comnstraints(id int not null,salary double,hiring_date date default '2021-01-01',unique (id),check (salary > 1000));
Query OK, 0 rows affected (0.07 sec)

mysql> insert into employee_with_comnstraints values(1,3000,'2021-09-19');
Query OK, 1 row affected (0.02 sec)

mysql> insert into employee_with_comnstraints values(2,300,'2021-09-19');
mysql> insert into employee_with_comnstraints values(2,3000,'2021-09-19');
Query OK, 1 row affected (0.01 sec)

mysql> select * from employee_with_comnstriants;
mysql> select * from employee_with_comnstraints;
+----+--------+-------------+
| id | salary | hiring_date |
+----+--------+-------------+
|  1 |   3000 | 2021-09-19  |
|  2 |   3000 | 2021-09-19  |
+----+--------+-------------+
2 rows in set (0.00 sec)

mysql> insert into employee_with_comnstraints values(2,3000,null);
ERROR 1062 (23000): Duplicate entry '2' for key 'employee_with_comnstraints.id'
mysql> insert into employee_with_comnstraints values(3,3000,null);
Query OK, 1 row affected (0.00 sec)

mysql> select * from employee_with_comnstraints;
+----+--------+-------------+
| id | salary | hiring_date |
+----+--------+-------------+
|  1 |   3000 | 2021-09-19  |
|  2 |   3000 | 2021-09-19  |
|  3 |   3000 | NULL        |
+----+--------+-------------+
3 rows in set (0.00 sec)

mysql> insert into employee_with_comnstraints(id,salary) values(4,3000,);
ERROR 1064 (42000): You have an error in your SQL syntax; check the manual that corresponds to your MySQL server version for the right syntax to use near ')' at line 1
mysql> insert into employee_with_comnstraints(id,salary) values(4,3000);
Query OK, 1 row affected (0.00 sec)

mysql> select * from employee_with_comnstraints;
+----+--------+-------------+
| id | salary | hiring_date |
+----+--------+-------------+
|  1 |   3000 | 2021-09-19  |
|  2 |   3000 | 2021-09-19  |
|  3 |   3000 | NULL        |
|  4 |   3000 | 2021-01-01  |
+----+--------+-------------+
4 rows in set (0.00 sec)

mysql> create table if not exists employee_with_constraints_temp(id int not null,name varchar(50) not null,salary double,hiring_date date default '2021-01-01',constraint unique_id unique (id),constraint salary_check check (salary > 1000));
Query OK, 0 rows affected (0.03 sec)

mysql> insert into employee_with_constraints_temp values(1.'Samarth',500,'2021-09-15');
ERROR 1064 (42000): You have an error in your SQL syntax; check the manual that corresponds to your MySQL server version for the right syntax to use near ''Samarth',500,'2021-09-15')' at line 1
mysql> insert into employee_with_constraints_temp values(1,'Samarth',500,'2021-09-15');
ERROR 3819 (HY000): Check constraint 'salary_check' is violated.
mysql> --alter
    -> ;
ERROR 1064 (42000): You have an error in your SQL syntax; check the manual that corresponds to your MySQL server version for the right syntax to use near '--alter' at line 1
mysql> ceate table employees(id int,name varchar(50),address varchar(50),city varchar(50));
ERROR 1064 (42000): You have an error in your SQL syntax; check the manual that corresponds to your MySQL server version for the right syntax to use near 'ceate table employees(id int,name varchar(50),address varchar(50),city varchar(5' at line 1
mysql> create table employees(id int,name varchar(50),address varchar(50),city varchar(50));
Query OK, 0 rows affected (0.02 sec)

mysql> insert into employees value(1,'Samarth','Krishna Nagar','BSR');
Query OK, 1 row affected (0.01 sec)

mysql> select * from employees;
+------+---------+---------------+------+
| id   | name    | address       | city |
+------+---------+---------------+------+
|    1 | Samarth | Krishna Nagar | BSR  |
+------+---------+---------------+------+
1 row in set (0.00 sec)

mysql> alter table employees add DOB date;
Query OK, 0 rows affected (0.01 sec)
Records: 0  Duplicates: 0  Warnings: 0

mysql> select * from employees;
+------+---------+---------------+------+------+
| id   | name    | address       | city | DOB  |
+------+---------+---------------+------+------+
|    1 | Samarth | Krishna Nagar | BSR  | NULL |
+------+---------+---------------+------+------+
1 row in set (0.00 sec)

mysql> show create table employees;
+-----------+--------------------------------------------------------------------------------------------------------------------------------------------------------------------------------------------------------------------------------------------------------------+
| Table     | Create Table                                                                                                                                                                                                                                                 |
+-----------+--------------------------------------------------------------------------------------------------------------------------------------------------------------------------------------------------------------------------------------------------------------+
| employees | CREATE TABLE `employees` (
  `id` int DEFAULT NULL,
  `name` varchar(50) DEFAULT NULL,
  `address` varchar(50) DEFAULT NULL,
  `city` varchar(50) DEFAULT NULL,
  `DOB` date DEFAULT NULL
) ENGINE=InnoDB DEFAULT CHARSET=utf8mb4 COLLATE=utf8mb4_0900_ai_ci |
+-----------+--------------------------------------------------------------------------------------------------------------------------------------------------------------------------------------------------------------------------------------------------------------+
1 row in set (0.00 sec)

mysql> #altering length of a varchar feild
mysql> alter table employees modify column name varchar(100);
Query OK, 1 row affected (0.04 sec)
Records: 1  Duplicates: 0  Warnings: 0

mysql> show create table employees;
+-----------+---------------------------------------------------------------------------------------------------------------------------------------------------------------------------------------------------------------------------------------------------------------+
| Table     | Create Table                                                                                                                                                                                                                                                  |
+-----------+---------------------------------------------------------------------------------------------------------------------------------------------------------------------------------------------------------------------------------------------------------------+
| employees | CREATE TABLE `employees` (
  `id` int DEFAULT NULL,
  `name` varchar(100) DEFAULT NULL,
  `address` varchar(50) DEFAULT NULL,
  `city` varchar(50) DEFAULT NULL,
  `DOB` date DEFAULT NULL
) ENGINE=InnoDB DEFAULT CHARSET=utf8mb4 COLLATE=utf8mb4_0900_ai_ci |
+-----------+---------------------------------------------------------------------------------------------------------------------------------------------------------------------------------------------------------------------------------------------------------------+
1 row in set (0.00 sec)

mysql> #delete column
mysql> alter table employees drop column city;
Query OK, 0 rows affected (0.01 sec)
Records: 0  Duplicates: 0  Warnings: 0

mysql> show create table employees;
+-----------+----------------------------------------------------------------------------------------------------------------------------------------------------------------------------------------------------------------------------+
| Table     | Create Table                                                                                                                                                                                                               |
+-----------+----------------------------------------------------------------------------------------------------------------------------------------------------------------------------------------------------------------------------+
| employees | CREATE TABLE `employees` (
  `id` int DEFAULT NULL,
  `name` varchar(100) DEFAULT NULL,
  `address` varchar(50) DEFAULT NULL,
  `DOB` date DEFAULT NULL
) ENGINE=InnoDB DEFAULT CHARSET=utf8mb4 COLLATE=utf8mb4_0900_ai_ci |
+-----------+----------------------------------------------------------------------------------------------------------------------------------------------------------------------------------------------------------------------------+
1 row in set (0.00 sec)

mysql> #rename
mysql> alter table employees rename column name to employee_name;
Query OK, 0 rows affected (0.01 sec)
Records: 0  Duplicates: 0  Warnings: 0

mysql> show create table employees;
+-----------+-------------------------------------------------------------------------------------------------------------------------------------------------------------------------------------------------------------------------------------+
| Table     | Create Table                                                                                                                                                                                                                        |
+-----------+-------------------------------------------------------------------------------------------------------------------------------------------------------------------------------------------------------------------------------------+
| employees | CREATE TABLE `employees` (
  `id` int DEFAULT NULL,
  `employee_name` varchar(100) DEFAULT NULL,
  `address` varchar(50) DEFAULT NULL,
  `DOB` date DEFAULT NULL
) ENGINE=InnoDB DEFAULT CHARSET=utf8mb4 COLLATE=utf8mb4_0900_ai_ci |
+-----------+-------------------------------------------------------------------------------------------------------------------------------------------------------------------------------------------------------------------------------------+
1 row in set (0.00 sec)

mysql> #truncate table - it only deletes data but not table structure i.e schema will be there
#syntax truncate table table_name;
mysql> #drop table- it delete everything
mysql> truncate table employees;
Query OK, 0 rows affected (0.02 sec)

mysql> select * from employyes;
mysql> select * from employees;
Empty set (0.00 sec)

mysql> drop table employees;
Query OK, 0 rows affected (0.01 sec)

mysql> select * from employees;
mysql> create table employees(id int,name varchar(50),address varchar(50),city varchar(50));
Query OK, 0 rows affected (0.05 sec)

mysql> insert into employees values(1,'Samarth','Bsr','BSR'),(2.'Shivam','SB','SB'),(3,'Aniket','MS','MS'),(4,'Sunil','DM','DM'),(5,'Krishan','SK','SK')
    -> ;
mysql> insert into employees values(1,'Samarth','Bsr','BSR'),(2,'Shivam','SB','SB'),(3,'Aniket','MS','MS'),(4,'Sunil','DM','DM'),(5,'Krishan','SK','SK');
Query OK, 5 rows affected (0.01 sec)
Records: 5  Duplicates: 0  Warnings: 0

mysql> select * from employees;
+------+---------+---------+------+
| id   | name    | address | city |
+------+---------+---------+------+
|    1 | Samarth | Bsr     | BSR  |
|    2 | Shivam  | SB      | SB   |
|    3 | Aniket  | MS      | MS   |
|    4 | Sunil   | DM      | DM   |
|    5 | Krishan | SK      | SK   |
+------+---------+---------+------+
5 rows in set (0.00 sec)

mysql> #applying constraints
mysql> alter table employees add constraint id_unique UNIQUE(id);
mysql> alter table employees add constraint id_unique UNIQUE(id);
Query OK, 0 rows affected (0.03 sec)
Records: 0  Duplicates: 0  Warnings: 0

mysql> insert into employees values(1,'Samarth','Bsr','BSR');


--- drop constraint from existing TABLE
alter table employee drop constraint id_unique;

insert into employee values(1,'XYZ', 25, '2021-08-10', 50000, 'Gurgaon');

--- create table with Primary_Key

Create table persons
(
    id int, 
    name varchar(50), 
    age int,
    ---Primary Key (id) 
    constraint pk Primary Key (id) 
);

insert into persons values(1,'Shashank',29);

--- Try to insert duplicate value for primary key COLUMN
insert into persons values(1,'Rahul',28);

--- Try to insert null value for primary key COLUMN
insert into persons values(null,'Rahul',28);

--- To check difference between Primary Key and Unique
alter table persons add constraint age_unq UNIQUE(age); 

select * from persons;


insert into persons values(2,'Rahul',28);


insert into persons values(3,'Amit',28);

insert into persons values(3,'Amit',null);

select * from persons;

insert into persons values(4,'Charan',null);

insert into persons values(5,'Deepak',null);


--- create tables for Foreign Key demo
create table customer
(
    cust_id int,
    name VARCHAR(50), 
    age int,
    constraint pk Primary Key (cust_id) 
);

create table orders
(
    order_id int,
    order_num int,
    customer_id int,
    constraint pk Primary Key (order_id),
    constraint fk Foreign Key (customer_id) REFERENCES customer(cust_id)
);

--- Differen between Drop & Truncate Command

select * from persons;
truncate table persons;

select * from persons;

drop table persons;

--- Operations with Select Command

select * from employee;


drop table employee;


create table if not exists employee(
    id int,
    name VARCHAR(50),
    age int,
    hiring_date date,
    salary int,
    city varchar(50)
);

insert into employee values(1,'Shashank', 24, '2021-08-10', 10000, 'Lucknow');

insert into employee values(2,'Rahul', 25, '2021-08-10', 20000, 'Khajuraho');

insert into employee values(3,'Sunny', 22, '2021-08-11', 11000, 'Bangalore');

insert into employee values(5,'Amit', 25, '2021-08-11', 12000, 'Noida');

insert into employee values(1,'Puneet', 26, '2021-08-12', 50000, 'Gurgaon');


select * from employee;

--- how to count total records
select count(*) from employee;


--- alias declaration
select count(*) as total_row_count from employee;


--- display all columns in the final result
select * from employee;


--- display specific columns in the final result
select name, salary from employee;


--- aliases for mutiple columns
select name as employee_name, salary as employee_salary from employee;


select * from employee;

--- print unique hiring_dates from the employee table when employees joined it
select Distinct(hiring_date) as distinct_hiring_dates from employee;


select * from employee;

--- How many unique age values in the table??

select  count(distinct(age)) as total_unique_ages from employee;

--- Increment salary of each employee by 20% and display final result with new salary
SELECT  id,
        name,
        salary as old_salary, 
        (salary + salary * 0.2) as new_salary
FROM employee;




#from my comp


Welcome to the MySQL monitor.  Commands end with ; or \g.
Your MySQL connection id is 15
Server version: 8.0.30 MySQL Community Server - GPL

Copyright (c) 2000, 2022, Oracle and/or its affiliates.

Oracle is a registered trademark of Oracle Corporation and/or its
affiliates. Other names may be trademarks of their respective
owners.

Type 'help;' or '\h' for help. Type '\c' to clear the current input statement.

mysql> use test;
Database changed
mysql> select * from employees;
+------+---------+---------+------+
| id   | name    | address | city |
+------+---------+---------+------+
|    1 | Samarth | Bsr     | BSR  |
|    2 | Shivam  | SB      | SB   |
|    3 | Aniket  | MS      | MS   |
|    4 | Sunil   | DM      | DM   |
|    5 | Krishan | SK      | SK   |
|    1 | Samarth | Bsr     | BSR  |
|    1 | Shivam  | SB      | SB   |
|    1 | Aniket  | MS      | MS   |
|    1 | Sunil   | DM      | DM   |
|    1 | Krishan | SK      | SK   |
+------+---------+---------+------+
10 rows in set (0.00 sec)

mysql> select * from employees where city = 'BSR';
+------+---------+---------+------+
| id   | name    | address | city |
+------+---------+---------+------+
|    1 | Samarth | Bsr     | BSR  |
|    1 | Samarth | Bsr     | BSR  |
+------+---------+---------+------+
2 rows in set (0.00 sec)

mysql> update employee set city='Banglore' where city='BSR';
ERROR 1054 (42S22): Unknown column 'city' in 'where clause'
mysql> update employee set city='Banglore' where city='BSR';
ERROR 1054 (42S22): Unknown column 'city' in 'where clause'
mysql> update employee set city='Banglore' where city='SK';
ERROR 1054 (42S22): Unknown column 'city' in 'where clause'
mysql> #delete specific record
mysql> delete from employee where city = 'BSR';
ERROR 1054 (42S22): Unknown column 'city' in 'where clause'
mysql> select * from employees where city = 'BSR';
+------+---------+---------+------+
| id   | name    | address | city |
+------+---------+---------+------+
|    1 | Samarth | Bsr     | BSR  |
|    1 | Samarth | Bsr     | BSR  |
+------+---------+---------+------+
2 rows in set (0.00 sec)

mysql> update employees set city='Banglore' where city='SK';
Query OK, 2 rows affected (0.04 sec)
Rows matched: 2  Changed: 2  Warnings: 0

mysql> select * from employees;
+------+---------+---------+----------+
| id   | name    | address | city     |
+------+---------+---------+----------+
|    1 | Samarth | Bsr     | BSR      |
|    2 | Shivam  | SB      | SB       |
|    3 | Aniket  | MS      | MS       |
|    4 | Sunil   | DM      | DM       |
|    5 | Krishan | SK      | Banglore |
|    1 | Samarth | Bsr     | BSR      |
|    1 | Shivam  | SB      | SB       |
|    1 | Aniket  | MS      | MS       |
|    1 | Sunil   | DM      | DM       |
|    1 | Krishan | SK      | Banglore |
+------+---------+---------+----------+
10 rows in set (0.00 sec)

mysql> delete from employees where city = 'Banglore';
Query OK, 2 rows affected (0.00 sec)

mysql> select * from employees;
+------+---------+---------+------+
| id   | name    | address | city |
+------+---------+---------+------+
|    1 | Samarth | Bsr     | BSR  |
|    2 | Shivam  | SB      | SB   |
|    3 | Aniket  | MS      | MS   |
|    4 | Sunil   | DM      | DM   |
|    1 | Samarth | Bsr     | BSR  |
|    1 | Shivam  | SB      | SB   |
|    1 | Aniket  | MS      | MS   |
|    1 | Sunil   | DM      | DM   |
+------+---------+---------+------+
8 rows in set (0.00 sec)

mysql> drop table employees;
Query OK, 0 rows affected (0.02 sec)

mysql> create table  employees(id int,name varchar(50),age int,hiring_date date,salary int,city varchar(50));
Query OK, 0 rows affected (0.03 sec)

mysql> insert into employees values(1,'Samarth',20,'2021-09-02',4000,'BSR'),(2,'Shivam',20,'2021-09-10',5000,'SB'),(3,'Aniket',24,'2021-09-12',5000,'MS'),(4,'Sunil',22,'2021-09-21',6000,'DK'),(5,'Krishan',21,'2021-09-30',7000,'SK');
Query OK, 5 rows affected (0.02 sec)
Records: 5  Duplicates: 0  Warnings: 0

mysql> select * from employees;
+------+---------+------+-------------+--------+------+
| id   | name    | age  | hiring_date | salary | city |
+------+---------+------+-------------+--------+------+
|    1 | Samarth |   20 | 2021-09-02  |   4000 | BSR  |
|    2 | Shivam  |   20 | 2021-09-10  |   5000 | SB   |
|    3 | Aniket  |   24 | 2021-09-12  |   5000 | MS   |
|    4 | Sunil   |   22 | 2021-09-21  |   6000 | DK   |
|    5 | Krishan |   21 | 2021-09-30  |   7000 | SK   |
+------+---------+------+-------------+--------+------+
5 rows in set (0.00 sec)

mysql> select count(*) from employees;
+----------+
| count(*) |
+----------+
|        5 |
+----------+
1 row in set (0.00 sec)

mysql> #limit records
mysql> select * from employees limit 3;
+------+---------+------+-------------+--------+------+
| id   | name    | age  | hiring_date | salary | city |
+------+---------+------+-------------+--------+------+
|    1 | Samarth |   20 | 2021-09-02  |   4000 | BSR  |
|    2 | Shivam  |   20 | 2021-09-10  |   5000 | SB   |
|    3 | Aniket  |   24 | 2021-09-12  |   5000 | MS   |
+------+---------+------+-------------+--------+------+
3 rows in set (0.00 sec)

mysql> #arranging our output i.e organizing data
mysql> select salary from employees orderby;
+--------+
| salary |
+--------+
|   4000 |
|   5000 |
|   5000 |
|   6000 |
|   7000 |
+--------+
5 rows in set (0.00 sec)

mysql> select salary from employees orderby=desc;
mysql> select * from employees order by salary;
+------+---------+------+-------------+--------+------+
| id   | name    | age  | hiring_date | salary | city |
+------+---------+------+-------------+--------+------+
|    1 | Samarth |   20 | 2021-09-02  |   4000 | BSR  |
|    2 | Shivam  |   20 | 2021-09-10  |   5000 | SB   |
|    3 | Aniket  |   24 | 2021-09-12  |   5000 | MS   |
|    4 | Sunil   |   22 | 2021-09-21  |   6000 | DK   |
|    5 | Krishan |   21 | 2021-09-30  |   7000 | SK   |
+------+---------+------+-------------+--------+------+
5 rows in set (0.00 sec)

mysql> select * from employees order by salary desc;
+------+---------+------+-------------+--------+------+
| id   | name    | age  | hiring_date | salary | city |
+------+---------+------+-------------+--------+------+
|    5 | Krishan |   21 | 2021-09-30  |   7000 | SK   |
|    4 | Sunil   |   22 | 2021-09-21  |   6000 | DK   |
|    2 | Shivam  |   20 | 2021-09-10  |   5000 | SB   |
|    3 | Aniket  |   24 | 2021-09-12  |   5000 | MS   |
|    1 | Samarth |   20 | 2021-09-02  |   4000 | BSR  |
+------+---------+------+-------------+--------+------+
5 rows in set (0.00 sec)

mysql> #more than one order by
mysql> select * from employees order by age , salary desc
    -> ;
+------+---------+------+-------------+--------+------+
| id   | name    | age  | hiring_date | salary | city |
+------+---------+------+-------------+--------+------+
|    2 | Shivam  |   20 | 2021-09-10  |   5000 | SB   |
|    1 | Samarth |   20 | 2021-09-02  |   4000 | BSR  |
|    5 | Krishan |   21 | 2021-09-30  |   7000 | SK   |
|    4 | Sunil   |   22 | 2021-09-21  |   6000 | DK   |
|    3 | Aniket  |   24 | 2021-09-12  |   5000 | MS   |
+------+---------+------+-------------+--------+------+
5 rows in set (0.00 sec)

mysql> write  a query to display the details of employee with max sal
    -> ;
mysql> select * from employees order by salary desc limit 1;
+------+---------+------+-------------+--------+------+
| id   | name    | age  | hiring_date | salary | city |
+------+---------+------+-------------+--------+------+
|    5 | Krishan |   21 | 2021-09-30  |   7000 | SK   |
+------+---------+------+-------------+--------+------+
1 row in set (0.00 sec)

mysql> select * from employees order by salary  limit 1;
+------+---------+------+-------------+--------+------+
| id   | name    | age  | hiring_date | salary | city |
+------+---------+------+-------------+--------+------+
|    1 | Samarth |   20 | 2021-09-02  |   4000 | BSR  |
+------+---------+------+-------------+--------+------+
1 row in set (0.00 sec)

mysql>
